"_CORE_TERMS_OF_SERVICE";"Please read these Terms and Conditions carefully before using the services offered by Guidance Guide LLC (Parental Guidance).

INTRODUCTION
This Agreement contains the complete terms and conditions that apply to your participation in our site. The Agreement describes and encompasses the entire agreement between us and you, and supersedes all prior or contemporaneous agreements, representations, warranties and understandings with respect to the Site, the content and computer programs provided by or through the Site, and the subject matter of this Agreement. If you wish to become a member of this social networking website and communicate with other members, please read these terms of use carefully before using our site and its services. By accessing this site or using any part of the site or any content or services hereof, you agree to become bound by these terms and conditions. If you do not agree to all the terms and conditions, then you may not access the site or use the content or any services in the site. Amendments to this agreement can be made and effected by us from time to time without specific notice to your end. Agreement posted on the Site reflects the latest agreement and you should carefully review the same before you use our site.

USE OF THE SITE & PROHIBITIONS
This site allows you to join social networks, gain friends, mingle with other members express your thoughts, and make some comments and discussion, and communicate with other members. You understand and agree, however, that you will use this site including its tools and services with full sense of responsibility and in a manner that is consistent with these Terms and in such a way as to ensure compliance with all applicable laws and regulations. You agree that you will use the site and its services in compliance with all applicable local, state, national, and international laws, rules and
 regulations, including any laws regarding the transmission of technical data exported from your country of residence and all United States export control laws.
Influenster, in its sole discretion, has the right to remove content and suspend, terminate, deactivate or refuse registration or access to your account at any time, without notice and without liability, for any reason, including but not limited to violation of this Agreement, infringing on Intellectual Property and inactivity.
We reserve the right to monitor and review your account, content and activity for compliance with this Agreement. We may terminate or suspend your account or ability to use the service if you breach this Agreement, and we may remove any content that is unlawful, offensive, threatening, libelous, defamatory, obscene or otherwise objectionable or violates any party's intellectual property rights.
You may view, download for collection purposes only, and print pages or other contents from the website for your own personal use, subject to the restrictions set out below and elsewhere in these terms of use.
● (a) you must not use our sites, including its services and or tools if you are not able to form legally binding contracts, are under the age of 18, or are temporarily or indefinitely suspended from using our sites, services, or tools
● (b) you should not post any blogs, items, messages, and or contents that are inappropriate and fails to observe sense of decency and or would offend other persons;
● (c) you must not republish, sell, rent or sub-license any materials from this website including republication on another website;
● (d) you must not collect and disclose information about users’ personal information;
● (e) you must not reproduce, duplicate, copy or otherwise exploit material on our website for a commercial purpose
● (f) you must not post false, inaccurate, misleading, defamatory, or libelous content;
● (g) you must not take any action that may damage the rating or badge system.
● (h) You must not use our website in any way that causes, or may cause, damage to the website or impairment of the availability or accessibility of the website; or in
any way which is unlawful, illegal, fraudulent or harmful, or in connection with any unlawful, illegal, fraudulent or harmful purpose or activity.

REGISTRATION / MEMBER ACCOUNT
As a condition of becoming a member of this social networking website including the use of its tools, applications and services, you are required to register with the site and be required to provide password and user name. You must complete the full registration process and shall provide the site with accurate, complete, and updated registration information. Failure to do so shall constitute a breach of the Terms of Use, which may result in immediate termination of your account.
You are entirely responsible for maintaining the confidentiality of your password. You agree not to use the Member Account, Member profile, username, or password of another Member at any time. You agree to notify us immediately if you suspect any unauthorized use of your Member Account or Member profile or access to your password. You are solely responsible for any and all use of your Member Account and Member profile. You must not transmit any worms or viruses or any code of a destructive nature. Any information provided by you or gathered by the site or third parties during any visit to the site shall be subject to the terms of Guidance Guide’s Privacy Policy.

In addition, you may not register for more than one Member Account, register for a Member Account on behalf of an individual other than yourself or register a Member Account on behalf of any group or entity. Furthermore, you may not use or attempt to use another's Member Account without authorization from us or create a false identity on our Services.

Guidance Guide PROGRAMS
By joining Guidance Guide llc, members acknowledge that they are not guaranteed to receive anything in return, complimentary products and/or any other promotions or giveaways promoted on this website, emails or social media sites. Members who are selected for the items mentioned above must meet specific requirements for each program, which Guidance Guide may or may not disclose to members. These requirements are solely determined by Guidance Guide and may change at Guidance Guide discretion at any time. Guidance Guide reserves the right to postpone, change and/or cancel any scheduled or running programs at any time.

NON-COMMERCIAL USE BY MEMBERS.
Members on this social networking website are prohibited to use the services of the website in connection with any commercial endeavors or ventures. Juridical persons or entities including but not limited to organizations, companies, and/or businesses may not become Members of Guidance Guide and should not use the site for any purpose. Any items you receive as part of an Guidance Guide Program (eg. free products, prizes, etc) are NOT FOR RESALE. All products a members receives from Guidance Guide are meant only for the recipient to test, unless otherwise noted, as in the case where recipients are meant to share with a family member or friend or asked to hold a giveaway. In the case that a member is unable to use a product, he or she may pass along to a friend. In no case is it acceptable for any member to resell a product received through an Guidance Guide Program either online or offline. If a member is found to be exchanging products received via Guidance Guide for cash, his or her membership will be terminated immediately.

LINKS & FRAMINGS
Illegal and/or unauthorized uses of the Services, including unauthorized framing of or linking to the Sites will be investigated, and appropriate legal action may be taken. Some links, however, are welcome to the site and you are allowed to establish hyperlink to appropriate part within the site provided that: (i) you post your link only within the forum, chat or message board section; (ii) you do not remove or obscure any advertisements, copyright notices or other notices on the placed at the site; (iii) the link does not state or imply any sponsorship or endorsement of your site and (iv) you immediately stop providing any links to the site on written notice from us. However, you must check the copyright notice on the homepage to which you wish to link to make sure that one of our content providers does not have its own policies regarding direct links to their content on our sites.

CHAT ROOMS, FORUMS, COMMUNICATIONS AND OTHER MATERIALS POSTED BY YOU
You are responsible for the content of your communications, messages and posts, and its consequences. We reserve the right to terminate your registration if we become aware, at our sole discretion, that you are violating any of the guidelines set forth in this agreement and privacy policy. While we want to encourage an open exchange of information and ideas, yet, we do not review postings made in any chat rooms, forums and other public-posting areas on the site. You can expect these areas to include information and opinions from a variety of individuals and organizations other than us. We do not endorse or guarantee the accuracy, integrity or quality of any posting, regardless of whether the posting comes from a user, from a celebrity or ""expert"" guest, or from a member of our staff.
By participating in this social networking site, you understand and agree not to post or transmit any material that, in our judgment, is defamatory, abusive, obscene, threatening or unlawful in any way, or any material that infringes on the rights of others or contains any virus or other computer programming routine which may interfere with or damage the site or otherwise interrupt on the ability of others to use or enjoy the same. We reserve the right to delete, move or edit any postings that come to our attention that we consider unacceptable or inappropriate, whether for legal or for any other reason. Furthermore, we reserve the right to deny access to anyone who we believe, in our sole discretion, has in any way breached these Terms or where we reasonably believe a user does not comply with any relevant age restrictions on the site. All public posts by members on Guidance Guide.com, including our Product Review pages, become proprietary information for Guidance Guide. Guidance Guide holds the right to share/publish these comments with the public and with clients. Members are in no way obligated to talk, promote or discuss products and brands they experience through Guidance Guide. Should members want to discuss, review, blog, make videos and/or write on social media about products or brands they test complimentary through Guidance Guide , members agree to properly disclose that they received the product complimentary through Guidance Guide and follow all FTC guidelines and regulations. Members who participate in Guidance Guide programs also agree not to post or transmit any material on other websites and social media sites, blogs and videos that, in our judgment, is defamatory, abusive, obscene, threatening or unlawful in any way. All members agree not to use inappropriate language and phrases when on the Guidance Guide website and when participating and communicating about Guidance Guide programs and product sponsors on outside websites, blogs, videos and other platforms.

DISCLOSURE POLICY
Guidance Guide contains product reviews by its members and others, which are given in response to receipt of free products straight from the manufacturers. Neither Guidance Guide or its members are instructed, coached, coerced, paid, or compensated in any fashion in exchange for reviews of manufacturer’s products. All reviews are provided voluntarily, and published for the informational purposes. All members are encouraged to disclose their receipt of free products whenever they make any public statements about them, either through Guidance Guide or independently. Our mission is to provide the best product feedback available anywhere on the web, and it is of the utmost importance to us that we remain as transparent as possible.

WARRANTY DISCLAIMER AND EXCLUSIONS / LIMITATIONS OF LIABILITY
You represent and warrant that (a) all of the information provided by you to our website to participate in the Service is correct and current; and (b) you have all necessary right, power and authority to enter into this Agreement and to perform the acts required of you hereunder.

You hereby accept and agree that it is beyond our control, and no duty to take any action regarding: which users gain access to the Site or use the Services; what effects the Content may have on you; how you may interpret or use the Content; or what actions you may take as a result of having been exposed to the Content. You release us from all liability for you having acquired or not acquired Content through the Site or the Services.

It should be noted that the Site or Services may contain, or direct you to sites containing, information that some people may find offensive or inappropriate. We make no representations concerning any content contained in or accessed through the Site or Services, and we will not be responsible or liable for the accuracy, copyright compliance, legality or decency of material contained in or accessed through the Site or the Services.

Guidance Guide is a distributor only. Products distributed by Guidance Guide are not manufactured by Guidance Guide. The products may, however, be covered by each manufacturer’s warranty, service, and support policy (if present).Guidance Guide assigns and passes through to the customer any warranty of the manufacturer, and you acknowledge that you shall have recourse only under such warranties and only as against the manufacturer of the products. Guidance Guide makes no representation of express warranty with respect to the product except those stated in this document. THE SERVICE, CONTENT, AND SITE ARE PROVIDED ON AN ""AS IS"" BASIS, WITHOUT WARRANTIES OF ANY KIND, EITHER EXPRESS OR IMPLIED, INCLUDING, WITHOUT LIMITATION, IMPLIED WARRANTIES OF MERCHANTABILITY, FITNESS FOR A PARTICULAR PURPOSE OR NON-INFRINGEMENT.

LIMITATION OF LIABILITY IN ALL CIRCUMSTANCES GUIDANCE GUIDE MAXIMUM LIABILITY IS LIMITED TO $100. Guidance Guide SHALL NOT, UNDER ANY CIRCUMSTANCES, BE LIABLE UPON A CLAIM OR ACTION IN CONTRACT, TORT, INDEMNITY OR CONTRIBUTION, OR OTHER CLAIMS RELATING TO THE PRODUCTS IT SELLS WHICH EXCEEDS THIS LIABILITY LIMIT. Guidance Guide SHALL NOT BE LIABLE FOR THIRD PARTY CLAIMS FOR DAMAGES AGAINST THE CUSTOMER, OR FOR MALFUNCTION, DELAYS, LOSS OF BUSINESS, LOSS OR DAMAGE TO EXEMPLARY DAMAGES, WHETHER OR NOT Guidance Guide HAS BEEN MADE AWARE OF THE POSSIBILITY OF SUCH CLAIMS OR DAMAGES.

In addition, we make no representation that the operation of our site will be uninterrupted or error-free, and we will not be liable for the consequences of any interruptions or errors. We may change, restrict access to, suspend or discontinued the site or any part of it at anytime. The information, content and services on the site are provided on an “as is” basis. When you use the site and or participate herein, you understand and agree that you participate at your own risk.

INTELLECTUAL PROPERTY RIGHTS
The Web allows people throughout the world to share valuable information, ideas and creative works. To ensure continued open access to such materials, we all need to protect the rights of those who share their creations with us. Although we make the Site freely accessible, we don't intend to give up our rights, or anyone else's rights, to the materials appearing on them. The materials available on the site shall remain the property of Guidance Guide and/or its licensors, and are protected by copyright, trademark and other intellectual property laws. You acquire no proprietary interest in any such rights. Furthermore, you may not remove or obscure the copyright notice or any other notices contained in the site or anything retrieved or downloaded from them. You hereby acknowledge that all rights, titles and interests, including but not limited to rights covered by the Intellectual Property Rights, in and to the site, and that You will not acquire any right, title, or interest in or to the site except as expressly set forth in this Agreement. You will not modify, adapt, translate, prepare derivative works from, decompile, reverse engineer, disassemble or otherwise attempt to derive source code from any of our services, software, or documentation, or create or attempt to create a substitute or similar service or product through use of or access to the Program or proprietary information related thereto.

""Public Content"" refers to information that you submit or post to or through the site and/or service for public display, such as photos, comments, reviews, and your public profile information. By submitting Public Content or any other content on the site or otherwise through the service, you hereby do and shall grant Guidance Guide a worldwide, non-exclusive, irrevocable, royalty-free, fully paid, sub-licensable and transferable license to use, copy, edit, modify, reproduce, distribute, prepare derivative works of, display, perform, and otherwise fully exploit the content in connection with the site, the service and Guidance Guide (and its successors and assigns') business, including without limitation for promoting and redistributing part or all of the site (and derivative works thereof) or the service in any media formats and through any media channels (including, without limitation, third party websites and feeds). You also hereby do and shall grant each user of the site and/or the service a non-exclusive license to access your content through the site and the service, and to use, edit, modify, reproduce, distribute, prepare derivative works of, display and perform such content in connection with their use of the site and service.

CONFIDENTIALITY
You agree not to disclose information you obtain from us and or from our clients, advertisers, suppliers and forum members. All information submitted to by an end-user customer pursuant to a Program is proprietary information of Guidance Guide. Such customer information is confidential and may not be disclosed. Publisher agrees not to reproduce, disseminate, sell, distribute or commercially exploit any such proprietary information in any manner.

NON-ASSIGNMENT OF RIGHTS
Your rights of whatever nature cannot be assigned nor transferred to anybody, and any such attempt may result in termination of this Agreement, without liability to us. However, we may assign this Agreement to any person at any time without notice.

WAIVER AND SEVERABILITY OF TERMS
Failure of the Guidance Guide to insist upon strict performance of any of the terms, conditions and covenants hereof shall not be deemed a relinquishment or waiver of any rights or remedy that the we may have, nor shall it be construed as a waiver of any subsequent breach of the terms, conditions or covenants hereof, which terms, conditions and covenants shall continue to be in full force and effect. No waiver by either party of any breach of any provision hereof shall be deemed a waiver of any subsequent or prior breach of the same or any other provision.

In the event that any provision of these Terms and Conditions is found invalid or unenforceable pursuant to any judicial decree or decision, such provision shall be deemed to apply only to the maximum extent permitted by law, and the remainder of these Terms and Conditions shall remain valid and enforceable according to its terms.

ENTIRE AGREEMENT
This Agreement shall be governed by and construed in accordance with the substantive laws of Colorado, without any reference to conflict-of-laws principles. The Agreement describes and encompasses the entire agreement between us and you, and supersedes all prior or contemporaneous agreements, representations, warranties and understandings with respect to the Site, the contents and materials provided by or through the Site, and the subject matter of this Agreement.

CHOICE OF LAW; JURISDICTION; FORUM
Any dispute, controversy or difference which may arise between the parties out of, in relation to or in connection with this Agreement is hereby irrevocably submitted to the exclusive jurisdiction of the courts of Denver, to the exclusion of any other courts without giving effect to its conflict of laws provisions or your actual state or country of residence.

TERM
This Agreement will remain in full force and effect while you use the Website. You may terminate your membership at any time for any reason by following the instructions on the “TERMINATION OF ACCOUNT” in the setting page. We may terminate your membership for any reason at any time. If you are using a paid version of the Service and we terminate your membership in the Service because you have breached this Agreement, you will not be entitled to any refund of unused subscription fees. Even after your membership is terminated, certain sections of this Agreement will remain in effect.

STYLE GUIDES
Guidance Guide is a forum for your thoughtful reviews, photos, videos, tips and more. Thus, we've put together these general guidelines for keeping it clean and classy here on our site:
Guidance Guide  REVIEW SECTION
Go Bare: That’s right, bare it all. The best reviews are personal and passionate as well as open and honest. Writing a review of something you received from us? Make sure to disclose that you received the products free from Influenster for testing purposes.

Use Good Taste: We at Guidance Guide pride ourselves on our style, so don’t trash your reputation by using offensive language and imagery. Furthermore, threats, harassment, lewdness, hate speech, and other displays of bigotry will not be tolerated. Stay in Good Form: Let’s save the non sequiturs for the blogosphere. We expect your contributions to be relevant to the product you’re reviewing. Reviews aren't the place for rants about political ideologies, extraordinary circumstances, or other matters that don't address the core of the consumer experience.

Cut Out the Bias: Your contributions should be objective. Don’t review your own business or employer, your friends' or relatives' businesses, or businesses in your networking group.

Say It, Don’t Sell It: Guidance Guide is the power of YOU. Here, consumers have the final word, so let’s not muck up our review section with more commercial noise.

Keep Secrets: Remember the Golden Rule? Please respect the privacy of others. This means refraining from publishing personal information, close-up photos, and full names of any of your friends, enemies, and countrymen.

Innovation, Not Imitation: What you learned in middle school still applies - absolutely NO plagiarism. We want to hear from you, so show us your (own) stuff!

Avoid the Overstatement: It’s easy to get carried away. Please avoid exaggerating or misrepresenting your experience.

Be Picky - Click Hearts with Discretion: These hearts don’t mean whether you “Agree.” Like reviews only when they’re useful, helpful, and truthful. Reviews are sorted by what's most helpful, so make sure new visitors see the ones that shine.

Be Constructive: We all know how disappointing it can be when you buy something only to find it doesn’t work the way you thought it would. While it may be tempting to vent your frustrations here, remember that reviews should relay “what” and “why.” And please, for everyone’s sake, lay off the caps lock.

Be Creative: These reviews weren’t written by robots. Let the “you” shine through!
Have Questions?

Be Curious: Guidance Guide users have the answers. If you want to know more about a product, use the platform. But first, check that your question hasn’t already been asked. It probably has!

Share the Wealth: Think you’ve got the answer? Help out your fellow Guidance Guide BA’s with all the info you’ve got. Your answers should be helpful, honest, and relevant. Spread the knowledge!
*Please be advised that Guidance Guide retains the right to remove any inappropriate content or to revoke membership for Style Guide violations.

Privacy Policy EFFECTIVE AS OF MARCH 10, 2016
Your privacy, and the privacy of all users of Guidance Guide is important to us. Guidance Guide is committed to protecting your privacy online. Accordingly, Guidance Guide has developed this privacy policy that describes how we collect, use, and share your data (“Privacy Policy”). This Privacy Policy sets forth the policies and procedures of personal information received from users of the Service, including but not limited to the website at www.iguidanceguide.com and the mobile applications created by Guidance Guide including but not limited to The Baby Guy NYC Facebook and IG page and Thebabyguygearguide.com and Jennifer Buske Insta Gram page.
This Privacy Policy is applicable to all site visitors, registered users, and all other users of the Service.

The terms “We”, “Us”, and “Guidance Guide ” refer to the Guidance Guide Service. The terms “You” and “Your” refer to you, as a visitor or user of the Service.

By using the Service, you are consenting to our processing of your information as set forth in this Privacy Policy, as amended from time to time.

Further, you acknowledge that this Privacy Policy is part of our Terms of Service (“TOS”), which is incorporated by reference, and by accessing or using the Service, you agree to be bound by all of its terms and conditions. If you do not agree to these terms, and the terms and conditions in our TOS, you may not access or use the Service.

HOW WE COLLECT AND USE YOUR INFORMATION
Personal Information: When registering as a user to the Service, we receive and store information you enter or provide to us in any other way. The types of personal information collected may include your name, email address, URL, phone number, Twitter, Tumblr, Google Plus and/or Facebook usernames, location, use information regarding your use of the Service, browser information, and any other data that is tied to such information (collectively, “Personal Information”). The Personal Information you provide is used for such purposes as allowing you to set up a user account and profile that can be used to interact with other users through the Service, improving the content of the Service, customizing the advertising and content you see, and communicating with you about specials and new features. We may also draw upon this Personal Information in order to adapt the Services of our community to your needs, to research the effectiveness of our network and Services, and to develop new tools for the community.

Profiles: “Public Content” refers to information that you submit or post to the Service for public display, such as photos, comments, reviews, and your public profile information. Information Collected Automatically: When you use the Service, we automatically receive and record information on our server logs from your browser or mobile platform, including your location, IP address, cookie information, and the page you requested. This data is treated as non-Personal Information, except as required under applicable law.

HOW YOUR INFORMATION IS SHARED
Information about our users is an integral part of our business. We provide some of our services through affiliates, service providers, partners and other third parties. We may share Public Content, as well as a limited amount of Personal Information (including, but not limited to, your first name, last initial, and location) with third parties, who may in turn publicly display or publish this limited amount of Personal Information in connection with Public Content on their own website and media platforms. However, at any time you may visit the ""Account Settings"" page of your Member Account and opt-out of having some or all of your Personal Information made available to such third parties as described herein.

We encourage our service partners to adopt and post privacy policies. However, the use of your Personal information by our service partners is governed by the privacy policies of those service partners, and is not subject to our control.
We may disclose aggregated information concerning user behavior to third parties in connection with actual or prospective business relationship with those third parties, such as advertisers and content distributors. For example, we may disclose the number of users that have been exposed to, or clicked on, advertising banners.

In the future, may use third party advertising companies to serve ads when you visit the Service. These companies may use information about your Public Content (not including your name, address, email address, or telephone number) and activity related to your use of the Service to provide advertisements about goods and services of interest to you.

One of the primary reasons people use Guidance Guide is to connect with others. Information such as your name and photo, photos of your items, location, list of friends, and the comments you write is shared with the Guidance Guide community. Individuals reading this information may use it or disclose it to other individuals or entities without our control and without your knowledge. We therefore urge you to think carefully about including any specific information you may deem private in comments or other content (location or otherwise) that you create in the Service.

We employ other companies and people to perform tasks on our behalf, such as the creation of shipping labels, and need to share your information with them to provide services to you. Our agents do not have any right to use Personal Information we share with them beyond what is necessary to assist us, and they provide a comparable level of protection for your Personal Information.
Law Enforcement and Protection. We may disclose your Personal Information to third parties in a good faith belief that such disclosure is reasonably necessary to (a) take action regarding suspected illegal activities; (b) enforce or apply our TOS and Privacy Policy; (c) comply with legal process, such as a search warrant, subpoena, statute, or court order; or (d) protect our rights, reputation, and property, or that of our users, affiliates, or the public. Please note that we are not required to question or contest the validity of any search warrant, subpoena or other similar governmental request that we receive.

Invite Friends and Contacts. You may choose to provide us with another person's e-mail address or social network profile information so that person may be invited to create an account on this site and become your friend. We use this information to contact and, if necessary, remind that person about the invitation. By providing us with another person's e-mail address, you represent to us that you have obtained the consent of the person concerned with respect to such disclosure to us of their Personal Information. We may disclose such information if required to do so in order to comply with legal process, as described above.

Business Transfers. If Guidance Guide or substantially all of Guidance Guide assets are acquired, or in the unlikely event that we cease business operations or enter bankruptcy, user information would be one of the assets that is transferred or acquired by a third party.

COOKIES AND SIMILAR TECHNOLOGIES
We send cookies to your computer or mobile device through your browser to enable our systems to recognize your browser and tell us how and when pages in our site are visited and by how many people. Most browsers have an option for disabling the cookie feature, which will prevent your browser from accepting cookies, as well as (depending on your browser software) allow you to decide on acceptance of cookies in a variety of ways.

Ads appearing on the Service may be delivered to users by our advertising partners, who may set cookies. These cookies allow the ad server to recognize your computer each time they send you an online advertisement to compile information about you or others who use your computer. This information allows ad networks to, among other things, deliver targeted advertisements that they believe will be of most interest to you. This PrivacyPolicy covers the use of cookies by us and our service providers and does not cover the use of cookies by any advertisers.

We use analytics (and related analytics programs) to better understand who is using the Service, and how people are using it. Analytics uses cookies to collect and store anonymous information such as time of visit, pages visited, time spent on each page of the website, IP address, and type of operating system used. We use this information to improve the Service and make it appealing to as many users as possible.

LOCATION INFORMATION
If your location settings are turned on when you use the Service, we use the location information from your mobile device or browser to tailor your experience. We collect and store your last known location to determine your proximity to our service partners. This location information is not shared with third parties. The Service also uses your mobile device’s background location to provide the Service, which allows us to provide you with location-based services, such as location-specific promotions, mobile-based campaign activity capabilities, and other personalized content tailored to you. If you have background location turned on, the mobile application will, from time to time, tell us about your device’s location even if you are not directly interacting with the application.

HOW WE RESPOND TO DO NOT TRACK SIGNALS
We do not currently recognize automated browser signals regarding tracking mechanisms, which may include ""Do Not Track"" instructions. You can change your privacy preferences regarding the use of cookies and similar technologies through your browser. For more information on Do Not Track please visit http://www.allaboutdnt.org/

SECURITY
Your account is password protected for your privacy and security. You need to prevent unauthorized access to your account and Personal Information by selecting and protecting your password, and limiting access to your computer, phone and browser such as signing off after you have finished accessing your account. We use industry standard measures to protect Personal Information. However, we cannot guarantee the security of account information. Unauthorized entry or use, hardware or software failure, and other factors, may compromise the security of user information at any time.

The Service may contain links to other sites. We are not responsible for the privacy policies and/or practices on other sites. When linking to another site, you should read the privacy policy stated on that site. This Privacy Policy only governs information collected on the Service.

INTERNATIONAL USERS
If you are located outside of the United States, please note that the Service is located on computer servers in the United States. Therefore, your information may be processed and stored in the United States. As a result, United States federal and state governments, courts, or law enforcement or regulatory agencies may be able to obtain disclosure of your information through laws applicable in the United States. Your use of the Service or your submission of any Personal Information to us will constitute your consent to the transfer of your Personal Information outside of your home country, including the United States, which may provide for different data protection rules than in your country.

CHILDREN
The Service is not directed toward children under 13 years of age nor do we knowingly collect information from children under 13. If you are under 13 years of age, you are not permitted to submit any Personal Information to us.

PRIVACY PRACTICES OF THIRD PARTIES AND THIRD PARTY SITES
The Service may contain links to third party websites to which we have no affiliation. Except as otherwise discussed in this Privacy Policy, this document only addresses the use and disclosure of information we collect from you. Other sites accessible through our site via links or service partnerships have their own privacy policies and data collection, use and disclosure practices. Please consult each site’s privacy policy. We are not responsible for the policies or practices of third parties. Additionally, other companies may place advertising on our site and may collect information about you when you view or click on their advertising through the use of cookies. 

We cannot control this collection of information. You should contact these advertisers directly if you have any questions about their use of the information that they collect.

CONTROL OF PERSONAL INFORMATION
To the extent you include Personal Information in your Public Content (such as a photo of yourself), third parties may be able to identify you, associate you with your account, and contact you. Please do not include information in your Public Content that you expect to keep private.

Third parties can also associate you with your account using the user search and browse features of the Guidance Guide Service, which display your Public Content. Upon your request, we will use commercially reasonable efforts to close your account, and cease displaying your Public Content on the Service; nevertheless, we may still retain your Personal Information and your Public Content in our systems. Registered users who wish to close their account should contact us.

CHANGES TO THE PRIVACY POLICY
We may amend this Privacy Policy from time to time. Use of information we collect now is subject to the Privacy Policy in effect at the time such information is used. If we make material changes in the way we use Personal Information, we will notify you by posting an announcement, sending you an email, or updating the Privacy Policy on the site. You are encouraged to review the Privacy Policy from time to time in the event changes have been made. Users are bound by any changes to the Privacy Policy when they use the Service after such changes have been first posted.

Appendix: Guidance Guide LLC Brand Ambassador Agreement

This Brand Ambassador Agreement [the “Agreement”] is entered into between Guidance Guide LLC [“the Company”, “Guidance Guide”, “we”, “us”, “our”] and the person whose name, contact information and signature appears in the electronic signature of this Agreement [“Brand Ambassador”, “BA”, “you” or “your”], and is effective upon BA’s electronic signature [“Effective Date”]. Collectively Company and BA shall be referred to as the “Parties”, or in their singular, “Party”.  

WHEREAS, Company operates an online social platform [the “Site”] that posts, among other things, product reviews and photographs submitted by brand ambassadors and others on behalf of select companies for the benefit of its subscribers and viewers [the “Guidance Guide Community”]; and

WHEREAS, Company wishes to engage Brand Ambassador, and Brand Ambassador wishes to review products for Guidance Guide.

NOW, THEREFORE, in consideration of the promises and of the mutual covenants, conditions, and limitations herein contained, the Parties do hereby agree as follows:

Section 1. Services. BA agrees, on a non-exclusive basis, to provide a truthful review and/or endorsement of certain product(s) [“Product” or “Products”] designated by Company, consisting of 100-300 words and 2-3 high-resolution, well-lit images [the “Services”], in exchange for complimentary Product sample(s). All Services must be completed and submitted to the Company within three (3) weeks of receipt of the Product(s). All reviews must state that the Product was complimentary, and all submissions must comply with the Site’s Terms of Use.

Section 2. Compensation. In consideration for the performance of the Services and the rights and releases granted herein, BA shall receive complimentary Product in a quantity to be determined by us in our sole discretion. There shall be no monetary compensation for the Services. BA shall not be reimbursed for any expenses, costs or fees associated with the Services, and none should be incurred in the performance of the Services.

Section 3. No obligation. BA is not obligated to provide the Services for Company, and Company is not obligated to provide BA with an opportunity to provide the Services and may cease providing such opportunities any time in its sole discretion with no obligation to BA. Further, Company does not guaranty that BA’s submission(s) will be published.

Section 4. Restrictions.
        
a. No Misrepresentation. BA will not misrepresent any Product, or intentionally do anything that would lead to any misunderstanding about the Product being reviewed.

b. Intellectual Property. BA will not violate the copyright and trademark rights of Guidance Guide and the manufacturer of the Product(s) and will not engage in any behavior that disparages, diminishes or violates any of the Guidance Guide or Manufacturer’s intellectual property rights.

c. No Resale. BA must use any Products for personal use only, and may not resell, lease or rent such Product(s) to any third party for any reason whatsoever.

Section 5. Release & Use of Likeness. BA hereby grants to the Company, and any of the Company’s assigns, licensors, affiliates and clients, the irrevocable and perpetual non-exclusive license to use all materials BA submits to Company resulting from the Services, including but not limited to BA’s name, likeness, image and appearance, or BA’s minor child(ren)’s name, likeness, image and appearance as embodied in the photographs or any materials submitted to Company by BA as a result of the Services [“Submitted Materials”], worldwide on the Site, via any and all social media and all media, whether now known or later developed. This grant includes without limitation the right to edit and duplicate and to use or re-use the Submitted Materials in whole or part as Company may elect. The rights granted herein include, but are not limited to, the right to include Submitted Materials as may be edited, in promotional materials, Site content, social media, the World Wide Web, marketing, materials and literature, any form of advertising or commerce and in any other manner in support of the Company or Product.

BA irrevocably waives any and all right to inspect and/or approve Company’s use of the Submitted Materials and/or BA’s or any of BA’s Children’s Likeness, including without limitation any text, image and/or other creative elements that may be used in connection with the Guidance Guide or the Site.

BA confirms he/she has the right to enter into this Agreement on behalf of itself and her/his minor children, that BA is not restricted by any commitments to third parties, and that Company has no financial commitment or obligations to BA or his/her child as a result of this Agreement or exploitation of the Submitted Materials, other than the receipt of complimentary Product which is hereby acknowledged as fair and reasonable for the rights granted herein. No further payments of any kind shall be due to BA or his/her child or any third party in exchange for the rights granted hereunder.

BA personally and on his/her children’s behalf, releases and discharges Company from any and all claims and demands ensuing or in connection with the use of BA’s photographs, including any and all claims for libel and invasion of privacy. BA further warrants and represents that it is the legal custodian of any minor children appearing in any such images, and that no third-party adults or children of whom BA is not legal custodian will appear in any such images.

Section 6. No Warranty. BA understands and agrees that the Company is not the manufacturer of the Product and does not warrant or guarantee the effectiveness, safety or quality of any particular Product. BA expressly waives any cause of action as and against Company and expressly releases company for any liability or any causes of action emanating from the Product(s).

Section 7. Termination. Either party may terminate this Agreement at any time for any reason. However, Sections 4, 5 and 6 shall survive in perpetuity.

Section 8. Representations and Warranties. BA represents and warrants that: (i) BA has the full and unrestricted right and authority to enter into and perform this Agreement and to grant the rights granted herein; (ii) BA has complied and will comply with all applicable laws, rules and regulations in rendering the services to be performed under this Agreement, including without limitation, the current FTC Guides Concerning the Use of Endorsements and Testimonials in Advertising (“FTC Guides”) and all related disclosure requirements; and, notwithstanding the termination provisions set forth herein, Company reserves the right to immediately terminate this Agreement if BA fails to make social media or other disclosures in the manner set forth in the FTC Guides, which failure shall be deemed a material breach of the Agreement that is not capable of cure; (iii) the Services are original to BA; (iv) the performance of the Services and submission of the Submitted Materials does not and will not violate the rights of any third party, including without limitation, any contract, copyright, trademark, or rights of privacy or publicity of any third-party; (v) the materials delivered pursuant to the Services will not contain any disparaging, pornographic, defamatory and/or offensive material; and; vi) BA will perform the Services in a timely, professional and workmanlike manner.

Section 9. Release/Indemnity. BA irrevocably and unconditionally releases, discharges and agrees to indemnify and hold harmless Company, its parents, subsidiaries and affiliates, and their respective officers, directors, employees, agents, assignees, designees and licensees, [the “Company Parties”], from and against all actions, claims, demands, causes of action, liabilities, damages, judgments, losses, costs, and expenses (including reasonable attorneys’ fees) of any kind whatsoever, whether known or unknown, arising at any time out of and/or relating to the use of the Services and/or BA’s or his/her Child(ren)’s likeness.

Section 10. Governing Law, Consent to Jurisdiction and Venue. This Agreement will be governed and construed in accordance with the laws of the State of Colorado. The Parties agree that all actions or proceedings arising in connection with this Agreement shall be tried and litigated exclusively in the State and Federal courts located in the State of Colorado, County of Douglas. This choice of venue is intended by the parties to be mandatory and not permissive in nature. BA waives any right he/she may have to assert the doctrine of forum non conveniens or similar doctrine or to object to venue with respect to any proceeding brought in accordance with this Agreement.

Section 11. Miscellaneous. This Agreement constitutes the entire understanding between the Company and BA with regard to the brand ambassador-related Services described herein, and is not intended to be (and shall not be) construed by, interpreted or otherwise linked to any other contract, agreement or understanding that may exist between the Company and BA, other than the Terms of Use on our Site. BA is, and at all times will remain, an independent contractor, and not an employee of the Company, within the meaning of all federal, state and local laws and regulations governing employment insurance, workers compensation, industrial accident, labor and taxes. This Agreement may be signed in counterparts, and each counterpart shall be deemed to be an original and all of which, when taken together, shall be deemed to be one agreement. The parties may sign and transmit this Agreement electronically. Company may assign any or all of Company’s rights and obligations under this Agreement without BA’s consent. BA may not assign BA’s rights and obligations under this Agreement. In the event that any provision of this Agreement is found invalid or unenforceable pursuant to any judicial decree or decision, such provision shall be deemed to apply only to the maximum extent permitted by law, and the remainder of these Terms of Use shall remain valid and enforceable according to its terms."
