"USER_FORM_ADMIN_SIGNUP_TERMS_DESCRIPTION";"Require members to agree to your terms of service?  You can modifying your terms of service by editing the _CORE_TERMS_OF_SERVICE language variable in the application/languages/en/core.csv file."
"ACTIVITY_TYPE_COMMENTED_CORE_LINK";"When someone comments on a link I commented on."
"ACTIVITY_TYPE_COMMENT_CORE_LINK";"When someone comments on one of my links."
"ACTIVITY_TYPE_LIKED_CORE_LINK";"When someone comments on a link I liked."
"ACTIVITY_TYPE_LIKE_CORE_LINK";"When someone likes one of my links."
"_CORE_ADMIN_STATS_VIDEO_EMBEDVIEWS";"Video Views from Embedding"
"_CORE_CONTACT_DESCRIPTION";"If you want to ask us a question directly, please submit your message with the following form."
"_CORE_HELP_CONTACT_MESSAGE";"Name: %1$s
Email: %2$s
Member Info: (%3$s - %4$s)
IP: %5$s
User-agent: %6$s
Timestamp: %7$s
Message:
    %8$s"
"_CORE_PRIVACY_STATEMENT";"Please refer to the Terms and Conditions located at http://parental.guidanceguide.com/help/terms

In short - we will protect your data like it was our own."
