"_CORE_ADMIN_STATS_CORE_VIEWS";"Page views"
"_CORE_ADMIN_STATS_USER_CREATIONS";"Sign-ups"
"_CORE_ADMIN_STATS_USER_LOGINS";"Sign-ins"
"_CORE_ADMIN_STATS_MESSAGES_CREATIONS";"Private messages"
"_CORE_ADMIN_STATS_USER_FRIENDSHIPS";"New friendships"
"_CORE_ADMIN_STATS_CORE_COMMENTS";"Comments"
"_CORE_ADMIN_STATS_CORE_LIKES";"Likes"
"_CORE_ADMIN_STATS_CORE_REPORTS";"Abuse reports"
"_CORE_ADMIN_STATS_CORE_UNIQUES";"Unique visitors"
"_CORE_ADMIN_STATS_ACTIVITY_POSTS";"Feed items"
"_CORE_ADMIN_STATS_AD_IMPRESSIONS";"Ad impressions"
"_CORE_ADMIN_STATS_AD_CLICKS";"Ad clicks"
"_CORE_ADMIN_STATS_ANNOUNCEMENT_CREATIONS";"Announcements"
"_CORE_ADMIN_STATS_CORE_EMAILS";"Emails Sent"
"CORE_VIEWS_SCRIPTS_ADMINADS_INDEX_DESCRIPTION";"Displaying advertisements is an excellent way to monetize your social network. By creating ad campaigns, you can determine exactly where your ads will appear, how long they will be displayed, and who they will be shown to. The key to generating substantial revenue from your social network is to create targeted ad campaigns. This means that you should make an effort to show specific ads to users based on their interests or personal characteristics (e.g. their profile information). To accomplish this, ad campaigns can be created for specific user levels and/or networks."
"CORE_FORM_ADMINS_LAYOUT_CONTENT_PAGE_LEVELS_DESCRIPTION";"Specify which member levels will be able to view this page. To show this page to all member levels, leave them all selected. If you want this page to be hidden from none registered members, please make sure you select deselect the public member level. Use CTRL-click to select or deselect multiple levels."
"CORE_FORM_ADMIN_ADS_CREATE_LIMITCTR_DESCRIPTION";"If you specify a minimum CTR (click-through ratio, which is the ratio of clicks to views) and the campaign's CTR goes below your limit, the campaign will end. If you decide to specify a minimum CTR limit, you should enter it as a percentage of clicks to views (e.g. 0.05%). To create a campaign with no definite end, don't specify limits and your campaign will continue until you choose to end it."
"CORE_FORM_ADMINS_ADS_CREATE_ADLEVELS_DESCRIPTION";"Specify which member levels will be shown advertisements from this campaign. To show this ad campaign to all member levels, leave them all selected. Use CTRL-click to select or deselect multiple levels."
"CORE_FORM_ADMINS_ADS_CREATE_ADNETWORKS_DESCRIPTION";"Specify which networks will be shown advertisements from this campaign. To show this ad campaign to all networks, leave them all selected. Use CTRL-click to select or deselect multiple networks."
"CORE_VIEWS_SCRIPTS_ADMINADS_MANAGEADS_DESCRIPTION";"Displaying advertisements is an excellent way to monetize your social network. By creating ad campaigns, you can determine exactly where your ads will appear, how long they will be displayed, and who they will be shown to. The key to generating substantial revenue from your social network is to create targeted ad campaigns. This means that you should make an effort to show specific ads to users based on their interests or personal characteristics (e.g. their profile information). To accomplish this, ad campaigns can be created for specific user levels and/or networks."
"CORE_FORM_ADMIN_ADS_AD_MEDIATYPE_DESCRIPTION";"Upload a banner image from your computer or specify your advertisement HTML code (e.g. Google Adsense). If you choose to upload an image, it must be a valid GIF, JPG, JPEG, or PNG file under 200kb."
"CORE_VIEWS_SCRIPTS_FANCYUPLOAD_DESCRIPTION";"This form is just an example fallback for the unobtrusive behaviour of FancyUpload. If this part is not changed, something must be wrong with your code."
"CORE_VIEWS_SCRIPTS_FANCYUPLOAD_ADDPHOTOS";"Click ""Add Photos"" to select a photo from your computer. After you have selected the photos, they will begin to upload right away. When your upload is finished, you will be able to preview the advertisement."
"ITEM_TYPE_CORE_PAGE";"Pages"
"CORE_VIEWS_SCRIPTS_ADMINLANGUAGE_EDIT_DESCRIPTION";"The language phrases in this pack are show below. If you're looking for a specific phrase, use the search box below to find it. Be sure to click ""Save Changes"" before moving to the next page of phrases if you want to keep your changes. Benealth each phrase, you'll see the original phrase for your reference. This is useful if you've lost or accidentally deleted a phrase. Some phrases are in plural form - you'll see examples of numbers used for these phrases in italics."
"CORE_VIEWS_SCRIPTS_ADMINLANGUAGE_INDEX_DESCRIPTION";"The layout of your community includes hundreds of phrases of text which are stored in a language pack. If you want to change any of these phrases, you can edit a language pack below. If you want to allow your members to pick from multiple languages, you can also create or import additional packs. If you have multiple packs installed, the pack you've marked as your ""default"" will be the language that displays if a member has not specified their language of choice."
"CORE_VIEWS_SCRIPTS_ADMINSTATS_INDEX_DESCRIPTION";"Stay connected to the pulse of your community by observing your site-wide statistics. The filters below allow you to observe various metrics and their change over different time periods."
"CORE_VIEWS_SCRIPTS_ADMINSTATS_REFERRERS_DESCRIPTION";"These are the 100 most common referring URLs tracked from your homepage. This indicates where most of your new traffic is coming from. Clearing the list periodically will give you fresh referrer data."
"CORE_VIEWS_SCRIPTS_ADMINSYSTEM_LOG_DESCRIPTION";"System logs are helpful for troubleshooting and debugging. Select the log you would like to view below."
"CORE_VIEWS_SCRIPTS_ADMINTHEMES_INDEX_DESCRIPTION";"Customize your community's overall look and feel by editing your current theme or choosing a new one. Themes consist of CSS files, which you can edit directly right here or via FTP on your server. If you want to make custom changes here, select the CSS file you want to edit from the pull-down menu below. If you would rather just pick an entirely different theme, use the theme chooser at the bottom. Customize your community's overall look and feel by editing your current theme or choosing a new one. Your theme consists of several CSS files. If you want to make custom changes to these files, select the one you want to edit from the pull-down below. If you would rather just pick an entirely different theme, use the theme chooser at the bottom."
"CORE_VIEWS_SCRIPTS_ADMINTHEMES_INDEX_REVERTTHEMEFILE";"Are you sure that you want to revert all the changes you have made to this theme? If yes, the original theme will be restored immediately and your changes lost. If you want to backup your changes, export it to your computer first."
"CORE_VIEWS_SCRIPTS_ADMINTHEMES_INDEX_STYLESHEETSPERMISSION";"The stylesheets for your current theme are not writeable. Please set full permissions recursively (CHMOD -R 0777) on ""application/themes/%s"" and try again."
"CORE_VIEWS_SCRIPTS_ADMINTHEMES_INDEX_REVERTTHEMECHANGES";"Are you sure that you want to revert all the changes you have made to this theme? If yes, the original theme will be restored immediately and your changes lost. If you want to backup your changes, export it to your computer first."
"CORE_LAYOUT_DESC";"Use the layout editor to decide what content appears on specific pages or in your site-wide header and footer. Click and drag the colored ""blocks"" to arrange the content you want on each page. Drag blocks to and from the ""Available Blocks"" area to add or remove them from your page. Use ""HTML Blocks"" if you want to drop in raw HTML or other content."
"CORE_VIEWS_SCRIPTS_ADMINPLUGINS_DESCRIPTION";"Plugins can extend and enhance many aspects of your social network. They often add new features for members, making your community more attractive and interactive. They can also give you more control over how your social network operates. If you've recently purchased a new plugin, you can install it by clicking the ""Add New Plugin"" link below."
"CORE_FORM_ADMIN_SETTINGS_GENERAL_DESCRIPTION";"Maintenance Mode will prevent site visitors from accessing your website.  You can customize the maintenance mode page by manually editing the file ""/application/maintenance.html""."
"CORE_FORM_ADMIN_SETTINGS_GENERAL_SITETITLE_DESCRIPTION";"Give your community a unique name. This will appear in the <title> tag throughout most of your site."
"CORE_FORM_ADMIN_SETTINGS_GENERAL_SITEDESCRIPTION_DESCRIPTION";"Enter a brief, concise description of your community. Include any key words or phrases that you want to appear in search engine listings."
"CORE_FORM_ADMIN_SETTINGS_GENERAL_SITEKEYWORDS_DESCRIPTION";"Provide some keywords (separated by commas) that describe your community. These will be the default keywords that appear in the <meta> tag in your page header. Enter the most relevant keywords you can think of to help your community's search engine rankings."
"CORE_FORM_ADMIN_SETTINGS_GENERAL_SITESCRIPT_DESCRIPTION";"To add javascript snippets to your site, enter the javascript here. Do not include the script tags."
"_EMAIL_PAYMENT_SUBSCRIPTION_CANCELLED_SUBJECT";"Your subscription has been cancelled."
"_EMAIL_PAYMENT_SUBSCRIPTION_CANCELLED_BODYHTML";"[header]<br> <br> Your subscription has been cancelled.<br> <br> [subscription_title]<br> [subscription_description]<br> [subscription_terms]<br> <br> Please follow the link below to renew your subscription.<br> <br> [object_link]<br> <br> [footer]"
"_EMAIL_FOOTER_SUBJECT";""
"_EMAIL_FOOTER_BODYHTML";"Sincerely,<br>Your Friends at Parental Guidance"
"_EMAIL_FOOTER_MEMBER_SUBJECT";""
"_EMAIL_FOOTER_MEMBER_BODYHTML";"Sincerely,<br>Your Friends at Parental Guidance"
"_EMAIL_FOOTER_BODY";"Sincerely,
Your Friends at Parental Guidance"
"_EMAIL_FOOTER_MEMBER_BODY";"Sincerely,
Your Friends at Parental Guidance"
"Use editor for messaging?";"Use editor for messaging?"
"USER_FORM_ADMIN_SETTINGS_LEVEL_MESSAGEEDITOR_DESCRIPTION";"You can choose to use an editor to help format and add media to your messages or use the default plain textbox with buttons to add media and share when allowed."
"Editor";"Expert"
"Edit the overview for your channel using the editor below, and then click 'Save Overview' to save changes.";"Edit the overview for your channel using the editor below, and then click 'Save Overview' to save changes."
"Do you want other widgets to also be displayed in the Welcome Tab? (You can place the desired widgets in this Welcome Tab page from the Layout Editor. Please note that if you enable this setting, then you should be sure to place the desired extra widgets in Welcome Tab, than the ones mentioned above.)";"Do you want other widgets to also be displayed in the Welcome Tab? (You can place the desired widgets in this Welcome Tab page from the Layout Editor. Please note that if you enable this setting, then you should be sure to place the desired extra widgets in Welcome Tab, than the ones mentioned above.)"
"Enter the number of friends till which users should be shown the Invite Friends block in the Welcome Tab (This block enables users to invite their contacts to become members of the site and their friends on it, by importing contacts from various services or manually entering email IDs. Those who are already site members get friend request. Users can thus quickly and easily grow their network on your site. Note that for this to be visible, you must place the ""Welcome: Invite Friends"" widget in this page from the Layout Editor. If you do not want this widget to be available in the Welcome Tab, then enter 0 below. This block will no more be visible to users in the Welcome Tab after their number of friends reaches the limit set by you.).";"Enter the number of friends till which users should be shown the Invite Friends block in the Welcome Tab (This block enables users to invite their contacts to become members of the site and their friends on it, by importing contacts from various services or manually 
entering email IDs. Those who are already site members get friend request. Users can thus quickly and easily grow their network on your site. Note that for this to be visible, you must place the ""Welcome: Invite Friends"" widget in this page from the Layout Editor. If you do not want this widget to be available in the Welcome Tab, then enter 0 below. This block will no more be visible to users in the Welcome Tab after their number of friends reaches the limit set by you.)."
"Enter the number of friends till which users should be shown the People You May Know block in the Welcome Tab (This block shows to users the people they may know and enables them to easily and quickly add them as friends to grow their network on your site. Note that for this to be visible, you must place the ""People you may know"" widget in this page from the Layout Editor. If you do not want this widget to be available in the Welcome Tab, then enter 0 below. This block will no more be visible to users in the Welcome Tab after their number of friends reaches the limit set by you.).";"Enter the number of friends till which users should be shown the  People You May Know block in the Welcome Tab (This block shows to users the people they may know and enables  them to easily and quickly add them as friends to grow their network on your site. Note that for this to be  visible, you must place the ""People you may know"" widget in this page from the Layout Editor. If you do not  want this widget to be available 
in the Welcome Tab, then enter 0 below. This block will no more be visible to users in the Welcome Tab after their number of friends reaches the limit set by you.). "
"How many suggestions do you want to display in the People You May Know block in the Welcome Tab? (Note: For this to be visible, please place the ""Welcome: Friends Suggestions"" widget in this Welcome page from the Layout Editor.)";"How many suggestions do you want to display in the People You May Know block in the  Welcome Tab? (Note: For this to be visible, please place the ""Welcome: Friends Suggestions"" widget in this Welcome page from the Layout Editor.) "
"Enter the number of friends till which users should be shown the Search for People block in the Welcome Tab (This block shows to users a search field to search for their friends who might be members of the site. This enables them to easily and quickly add them as friends to grow their network on your site. Note that for this to be visible, you must place the ""Welcome: Search for People"" widget in this page from the Layout Editor. If you do not want this widget to be available in the Welcome Tab, then enter 0 below. This block will no more be visible to users in the Welcome Tab after their number of friends reaches the limit set by you.).";"Enter the number of friends till which users should be shown the Search for People block in the Welcome Tab (This block shows to users a search field to search for their friends who might be members of the site. This enables them to easily and quickly add them as friends to grow their network on your site. Note that for this to be visible, you must place the ""Welcome: 
Search for People"" widget in this page from the Layout Editor. If you do not want this widget to be available in the Welcome Tab, then enter 0 below. This block will no more be visible to users in the Welcome Tab after their number of friends reaches the limit set by you.)."
"Do you want the Profile Photo block to be available in the Welcome Tab for users who have not uploaded a profile photo (This block will enable users to easily and quickly upload a profile photo, thus increasing trust on your website. Note that for this to be visible, you must place the ""Welcome: Profile Photo Uploading"" widget in this page from the Layout Editor.)?";"Do you want the Profile Photo block to be available in the Welcome Tab for users who have not uploaded a profile photo (This block will enable users to easily and quickly upload a profile photo, thus increasing trust on your website. Note that for this to be visible, you must place the ""Welcome: Profile Photo Uploading"" widget in this page from the Layout Editor.)?"
"Enter the number of days after signup till which users should be shown the Suggestions block in the Welcome Tab (This block shows to users suggestions of various content types of your site, thus enabling them to explore content and motivating them to generate their own content on your site. Note that for this to be visible, you must place the ""Explore Suggestions"" widget in this page from the Layout Editor. If you do not want this widget to be available in the Welcome Tab, then enter 0 below. This block will no more be visible to users in the Welcome Tab after their number of days after signup reaches the limit set by you. You can set the number of items to be visible in this from the Edit Settings for this widget.).";"Enter the number of days after signup till which users should be shown the Suggestions block in the Welcome Tab (This block shows to users suggestions of various content types of your site, thus enabling them to explore content and motivating them to generate their own content on your site. 
Note that for this to be visible, you must place the ""Explore Suggestions"" widget in this page from the Layout Editor. If you do not want this widget to be available in the Welcome Tab, then enter 0 below. This block will no more be visible to users in the Welcome Tab after their number of days after signup reaches the limit set by you. You can set the number of items to be visible in this from the Edit Settings for this widget.)."
"Enter the number of days after signup till which users should be shown the Popular Content block in the Welcome Tab (This block shows to users the most Liked items of your site, thus enabling them to explore quality content on your site. Note that for this to be visible, you must place the ""Welcome: Most Liked Items"" widget in this page from the Layout Editor. If you do not want this widget to be available in the Welcome Tab, then enter 0 below. This block will no more be visible to users in the Welcome Tab after their number of days after signup reaches the limit set by you.).";"Enter the number of days after signup till which users should be shown the Popular Content block in the Welcome Tab (This block shows to users the most Liked items of your site, thus enabling them to explore quality content on your site. Note that for this to be visible, you must place the ""Welcome: Most Liked Items widget in this page from the Layout Editor. If you do not want this widget to be available in the Welcome Tab, "
"How many likes do you want to display in the most liked items block in the Welcome Tab? (Note: For this to be visible, please place the ""Most Liked Items"" widget in this Welcome page from the Layout Editor.)";"How many likes do you want to display in the most liked items block in the Welcome Tab? (Note: For this to be visible, please place the ""Most Liked Items"" widget in this Welcome page from the Layout Editor.) "
"You will be able to vertically adjust the position of widgets on Welcome Tab page from the Layout Editor.";"You will be able to vertically adjust the position of widgets on Welcome Tab page from the Layout Editor."
"Below you can create and manage Custom Blocks for the Welcome Tab. You can use custom blocks to show welcome content to users which is different from the already available blocks. For example, you can introduce those features / aspects of your website that form your site's most important core features. You can order the blocks in desired sequence using drag-and-drop below. Note that for custom blocks to be visible, you must place the ""Welcome: Custom Blocks"" widget in Welcome Tab page from the Layout Editor.";"Below you can create and manage Custom Blocks for the Welcome Tab. You can use custom blocks to show welcome content to users which is different from the already available blocks. For example, you can introduce those features / aspects of your website that form your site's most important core features. You can order the blocks in desired sequence using drag-and-drop below. Note that for custom blocks to be visible, you must place the ""Welcome: Custom Blocks"" widget in Welcome Tab page from the 
Layout Editor."
"Below, you can configure the settings for the various blocks of Welcome Tab. Note that the Welcome Tab content can be placed anywhere on your website from the Layout Editor. It is a part of the Advanced Activity Feeds widget, and you can choose to show this tab from the Edit Settings of the widget.<br />You can use this feature to show welcome / introductory content to users. This tab will display welcome content to users and enable them to quickly familiarize and grow their network in your community. There are some pre-built widgets for this tab which easily and quickly get users going on your website, and you can also create your custom content. This feature enables users to quickly get familiar with your website, thus converting signups to frequent logins.<br />With below intelligent settings, you can configure Welcome Tab content such that different users are shown different content depending on their number of friends, and days since signup on you site.<br />You will be able to vertically adjust the 
position of widgets on Welcome Tab page from the <a href=""%s"">Layout Editor</a>.<br />";"Below, you can configure the settings for the various blocks of Welcome Tab. Note that the Welcome Tab content can be placed anywhere on your website from the Layout Editor. It is a part of the Advanced Activity Feeds widget, and you can choose to show this tab from the Edit Settings of the widget.<br />You can use this feature to show welcome / introductory content to users. This tab will display welcome content to users and enable them to quickly familiarize and grow their network in your community. There are some pre-built widgets for this tab which easily and quickly get users going on your website, and you can also create your custom content. This feature enables users to quickly get familiar with your website, thus converting signups to frequent logins.<br />With below intelligent settings, you can configure Welcome Tab content such that different users are shown different content depending on their number of 
friends, and days since signup on you site.<br />You will be able to vertically adjust the position of widgets on Welcome Tab page from the <a href=""%s"">Layout Editor</a>.<br />"
"Edit the overview for your blog using the editor below, and then click 'Save Overview' to save changes.";"Edit the body for your entry using the editor below, and then click 'Save Body' to save changes."
"Edit the overview for your product using the editor below, and then click 'Save Overview' to save changes.";"Edit the overview for your listing using the editor below, and then click 'Save Overview' to save changes."
"ANNOUNCEMENT_VIEW_SCRIPTS_ADMINMANAGE_DESCRIPTION";"Announcements are a great way to keep your members engaged in the community. Announcements appear inside the ""Announcement Widget"", which you can place anywhere on your site. By default, this widget appears at the top of the member homepage - this way, members see your announcements right when they sign in. You can move this widget elsewhere or change its settings in the <a href='%s'>Layout Editor</a>."
"SITEMOBILE_LAYOUT_DESC";"Use the layout editor to decide what content appears on specific pages or in your site-wide header and footer. Click and drag the colored ""blocks"" to arrange the content you want on each page. Drag blocks to and from the ""Available Blocks"" area to add or remove them from your page. Use ""HTML Blocks"" if you want to drop in raw HTML or other content.sss"
"_EMAIL_SITEREVIEW_EDITOR_ASSIGN_EMAIL_TITLE";"Multiple Listing Types - Member Becomes Editor"
"_EMAIL_SITEREVIEW_EDITOR_ASSIGN_EMAIL_DESCRIPTION";"This email goes to the members when they are made the editors to write editor reviews."
"_EMAIL_SITEREVIEW_EDITOR_ASSIGN_EMAIL_SUBJECT";" You have become an editor for listings."
"_EMAIL_SITEREVIEW_EDITOR_ASSIGN_EMAIL_BODY";"[header]

Congratulations! [sender] has made you an editor for listings of [listing_type]. You can now write / edit editor reviews for them.

To visit your editor page, click on the link below, or copy-paste it in your browser:
[editor_page_url]


[footer]"
"_EMAIL_SITEREVIEW_LISTING_CREATION_EDITOR_TITLE";"Multiple Listing Types - Listing Creation Email Notification to Editors"
"_EMAIL_SITEREVIEW_LISTING_CREATION_EDITOR_DESCRIPTION";"This email is sent to the editors when members post new listings."
"_EMAIL_SITEREVIEW_LISTING_CREATION_EDITOR_SUBJECT";"A new [listing_type] ‘[object_title]’ has been posted."
"_EMAIL_SITEREVIEW_LISTING_CREATION_EDITOR_BODY";"[header]

[object_title]
[object_description]

To visit and write editor review on this [listing_type], click on the link below, or copy-paste it in your browser:
[object_link]

[footer]"
"_EMAIL_SITEREVIEW_EDITORREVIEW_CREATION_TITLE";"Multiple Listing Types - Editor Review on Listings"
"_EMAIL_SITEREVIEW_EDITORREVIEW_CREATION_DESCRIPTION";"This email is sent to the members when editor write reviews on Listings that the member created."
"_EMAIL_SITEREVIEW_EDITORREVIEW_CREATION_SUBJECT";"[editor_name] has written a review on your ‘[object_parent_title]’."
"_EMAIL_SITEREVIEW_EDITORREVIEW_CREATION_BODY";"[header]

[editor] has written a review on your ‘[object_parent_with_link]’.

[object_title]
[object_description]

To view this review, click on the link below, or copy-paste it in your browser:
http://[host][object_link]

[footer]"
"_EMAIL_SITEREVIEW_EDITOR_EMAIL_TITLE";"Multiple Listing Types - Member Contacts Editor Email"
"_EMAIL_SITEREVIEW_EDITOR_EMAIL_DESCRIPTION";"This is the email that gets sent to editors when members contact them."
