"{item:$subject} commented on {item:$owner}'s {var:$listingtype} listing {item:$object:$title}: {body:$body}";"{item:$subject} commented on {item:$owner}'s potty learning item listing {item:$object:$title}: {body:$body}"
"1. Choose a potty learning item Package";"1. Choose a listing Package"
"Select a package that best matches your requirements. Packages differ in terms of features available to potty learning created under them. You can change your package anytime later.";"Select a package that best matches your requirements. Packages differ in terms of features available to listings created under them. You can change your package anytime later."
"Are you sure you want to change package for this Potty Learning Item? Once you change package, all the settings of this potty learning item will be applied according to the new package, including features available, price, etc.";"Are you sure you want to change package for this Listing? Once you change package, all the settings of this listing will be applied according to the new package, including features available, price, etc."
"If you want to change the package for your potty learning item, please select one package from the following list of available packages.";"If you want to change the package for your listing, please select one package from the following list of available packages."
"Note: Once you change package for your potty learning item, all the settings of the potty learning item will be applied according to the new package, including apps available, features available, price, etc.";"Note: Once you change package for your listing, all the settings of the listing will be applied according to the new package, including apps available, features available, price, etc."
"Thank you for submitting your payment. Your payment is currently pending - your potty learning item will be activated when we are notified that the payment has completed successfully. Please return to our login potty learning item when you receive an email notifying you that the payment has completed.";"Thank you for submitting your payment. Your payment is currently pending - your listing will be activated when we are notified that the payment has completed successfully. Please return to our login listing when you receive an email notifying you that the payment has completed."
"You have already applied for this potty learning item.";"You have already applied for this listing."
"Back to Dashboard potty learning item";"Back to Dashboard listing"
"Back to My potty learning";"Back to My listings"
"Thank you! Your payment for your potty learning item has been completed successfully.";"Thank you! Your payment for your listing has been completed successfully."
"Continue to Dashboard potty learning item";"Continue to Dashboard listing"
"Continue to My potty learning";"Continue to My listings"
"Your potty learning item is pending payment. You will receive an email when the
  payment completes.";"Your listing is pending payment. You will receive an email when the
  payment completes."
"You have created a potty learning item that requires payment. You will be taken to a secure checkout area where you can pay for your potty learning item.";"You have created a listing that requires payment. You will be taken to a secure checkout area where you can pay for your listing."
"Order your Potty Learning Item";"Order your Listing"
"Your Potty Learning Item requires payment:";"Your Listing requires payment:"
" to renew potty learning item.";" to renew listing."
"The package for your Potty Learning Item requires payment. You have not fulfilled the payment for this Potty Learning Item.";"The package for your Listing requires payment. You have not fulfilled the payment for this Listing."
"Your package for this Potty Learning Item has expired and needs to be renewed.";"Your package for this Listing has expired and needs to be renewed."
"Your package for this Potty Learning Item is about to expire and needs to be renewed.";"Your package for this Listing is about to expire and needs to be renewed."
"2. Configure your potty learning item based on the package you have chosen.";"2. Configure your listing based on the package you have chosen."
"Below, you can file a claim for a potty learning item on this community that you believe should be owned by you. Your request will be sent to the administration.";"Below, you can file a claim for a listing on this community that you believe should be owned by you. Your request will be sent to the administration."
"Potty Learning Item Name";"Listing Name"
"Start typing the name of the potty learning item";"Start typing the name of the listing"
"About You and the Potty Learning Item";"About You and the Listing"
"Renew Potty Learning Item";"Renew Listing"
"_EMAIL_SITEREVIEW_POTTY LEARNING ITEM_CANCELLED_TITLE";"Potty Learning Item Listing Cancelled"
"_EMAIL_SITEREVIEW_POTTY LEARNING ITEM_CANCELLED_DESCRIPTION";"This is the email that gets sent to a member when their potty learning item listing is cancelled."
"_EMAIL_SITEREVIEW_POTTY LEARNING ITEM_CANCELLED_SUBJECT";"Your potty learning item listing: [list_title] has been cancelled."
"_EMAIL_SITEREVIEW_POTTY LEARNING ITEM_CANCELLED_BODY";"[header]

Your potty learning item listing: [list_title_with_link] has been cancelled.

To visit this potty learning item listing, click on the link below, or copy-paste it in your browser:
[object_link]

If your potty learning item listing required to be renewed, then you may do so from its dashboard.

[footer]"
"_EMAIL_SITEREVIEW_POTTY LEARNING ITEM_EXPIRED_TITLE";"Potty Learning Item Listing Expired: (for free packages)"
"_EMAIL_SITEREVIEW_POTTY LEARNING ITEM_EXPIRED_DESCRIPTION";"This is the email that gets sent to a member when their potty learning item listing belonging to a free package expires."
"_EMAIL_SITEREVIEW_POTTY LEARNING ITEM_EXPIRED_SUBJECT";"Your potty learning item Listing: [list_title] has expired."
"_EMAIL_SITEREVIEW_POTTY LEARNING ITEM_EXPIRED_BODY";"[header]


Your potty learning item listing: [list_title_with_link] has expired. It has reached the limit of its package.


To visit this potty learning item listing, click on the link below, or copy-paste it in your browser:
[object_link]


[footer]"
"_EMAIL_SITEREVIEW_POTTY LEARNING ITEM_RENEW_TITLE";"Listing Expired: (for paid packages)"
"_EMAIL_SITEREVIEW_POTTY LEARNING ITEM_RENEW_DESCRIPTION";"This is the email that gets sent to a member when their listing belonging to a paid package expires."
"_EMAIL_SITEREVIEW_POTTY LEARNING ITEM_RENEW_SUBJECT";"Your potty learning item Listing: [list_title] has expired and needs to be renewed."
"_EMAIL_SITEREVIEW_POTTY LEARNING ITEM_RENEW_BODY";"[header]

Your potty learning item listing: [list_title_with_link] has expired. It has reached the limit of its package. You may renew this listing from its dashboard.

To visit this potty learning item listing, click on the link below, or copy-paste it in your browser:
[object_link]

[footer]"
"_EMAIL_SITEREVIEW_POTTY LEARNING ITEM_OVERDUE_TITLE";"Potty Learning Item Listing Overdue"
"_EMAIL_SITEREVIEW_POTTY LEARNING ITEM_OVERDUE_DESCRIPTION";"This is the email that gets sent to a member when their potty learning item listing is overdue."
"_EMAIL_SITEREVIEW_POTTY LEARNING ITEM_OVERDUE_SUBJECT";"Your potty learning item listing: [list_title] is overdue."
"_EMAIL_SITEREVIEW_POTTY LEARNING ITEM_OVERDUE_BODY";"[header]

Your potty learning item listing: [list_title_with_link] is overdue because of a failed or missed payment.

To visit this potty learning item listing, click on the link below, or copy-paste it in your browser:
[object_link]

To renew your potty learning item listing, you may do so from its dashboard.

[footer]"
"_EMAIL_SITEREVIEW_POTTY LEARNING ITEM_PENDING_TITLE";"Potty Learning Item Listing Activation Pending"
"_EMAIL_SITEREVIEW_POTTY LEARNING ITEM_PENDING_DESCRIPTION";"This is the email that gets sent to a member when their potty learning item listing activation is pending."
"_EMAIL_SITEREVIEW_POTTY LEARNING ITEM_PENDING_SUBJECT";"Your potty learning item listing activation is pending."
"_EMAIL_SITEREVIEW_POTTY LEARNING ITEM_PENDING_BODY";"[header]

Thank you for creating your potty learning item listing on our social network! Your listing activation is pending, awaiting completion of the transaction. Your listing will be activated soon; we will notify you by email when it is ready.
Thank you for your patience.

[list_title]
[list_description]

[footer]"
"_EMAIL_SITEREVIEW_POTTY LEARNING ITEM_ACTIVE_TITLE";"Potty Learning Item Listing Activated"
"_EMAIL_SITEREVIEW_POTTY LEARNING ITEM_ACTIVE_DESCRIPTION";"This is the email that gets sent to a member when their potty learning item listing is activated."
"_EMAIL_SITEREVIEW_POTTY LEARNING ITEM_ACTIVE_SUBJECT";"Your potty learning item listing: [list_title] is now active."
"_EMAIL_SITEREVIEW_POTTY LEARNING ITEM_ACTIVE_BODY";"[header]

Thank you for creating your potty learning item listing on [site_title]! Your listing is now active.

[list_title]
[list_description]

To visit this potty learning item listing, click on the link below, or copy-paste it in your browser:
[object_link]

[footer]"
"_EMAIL_SITEREVIEW_POTTY LEARNING ITEM_RECURRENCE_TITLE";"Potty Learning Item Listing Payment Recurrence"
"_EMAIL_SITEREVIEW_POTTY LEARNING ITEM_RECURRENCE_DESCRIPTION";"This is the email that gets sent to a member when they are billed for a recurring payment."
"_EMAIL_SITEREVIEW_POTTY LEARNING ITEM_RECURRENCE_SUBJECT";"Your payment for your potty learning item listing has been billed."
"_EMAIL_SITEREVIEW_POTTY LEARNING ITEM_RECURRENCE_BODY";"[header]

Your payment for your potty learning item listing has been billed. You should receive an email from the
payment gateway regarding this charge. Thank you for subscribing to our social
network.

[list_title]
[list_description]

To visit this potty learning item listing, click on the link below, or copy-paste it in your browser:
[object_link]

[footer]"
"_EMAIL_SITEREVIEW_POTTY LEARNING ITEM_REFUNDED_TITLE";"Potty Learning Item Listing Payment Refunded"
"_EMAIL_SITEREVIEW_POTTY LEARNING ITEM_REFUNDED_DESCRIPTION";"This is the email that gets sent to a member when their potty learning item listing payment is refunded."
"_EMAIL_SITEREVIEW_POTTY LEARNING ITEM_REFUNDED_SUBJECT";"Your payment for your potty learning item listing has been refunded."
"_EMAIL_SITEREVIEW_POTTY LEARNING ITEM_REFUNDED_BODY";"[header]

Your payment for your potty learning item listing has been refunded.

[list_title]
[list_description]

[footer]"
"_EMAIL_SITEREVIEW_POTTY LEARNING ITEM_APPROVED_TITLE";"Listing Approved"
"_EMAIL_SITEREVIEW_POTTY LEARNING ITEM_APPROVED_DESCRIPTION";"This is the email that gets sent to a member when their potty learning item listing is approved."
"_EMAIL_SITEREVIEW_POTTY LEARNING ITEM_APPROVED_SUBJECT";"Your potty learning item listing: [list_title] has been approved."
"_EMAIL_SITEREVIEW_POTTY LEARNING ITEM_APPROVED_BODY";"[header]

Thank you for creating your potty learning item listing on our social network! Your listing has now been approved.

[list_title]
[list_description]

To visit this listing, click on the link below, or copy-paste it in your browser:
[object_link]

[footer]"
"_EMAIL_SITEREVIEW_POTTY LEARNING ITEM_DISAPPROVED_TITLE";"Listing Disapproved"
"_EMAIL_SITEREVIEW_POTTY LEARNING ITEM_DISAPPROVED_DESCRIPTION";"This is the email that gets sent to a member when their listing is disapproved."
"_EMAIL_SITEREVIEW_POTTY LEARNING ITEM_DISAPPROVED_SUBJECT";"Your potty learning item listing: [list_title] has been disapproved."
"_EMAIL_SITEREVIEW_POTTY LEARNING ITEM_DISAPPROVED_BODY";"[header]

Your listing has been disapproved.

[list_title]
[list_description]

To visit this potty learning item listing, click on the link below, or copy-paste it in your browser:
[object_link]

[footer]"
"_EMAIL_SITEREVIEW_POTTY LEARNING ITEM_APPROVAL_PENDING_TITLE";"Potty Learning Item Listing Approval Pending"
"_EMAIL_SITEREVIEW_POTTY LEARNING ITEM_APPROVAL_PENDING_DESCRIPTION";"This is the email that gets sent to a member when their potty learning item listing is pending for approval."
"_EMAIL_SITEREVIEW_POTTY LEARNING ITEM_APPROVAL_PENDING_SUBJECT";"Your potty learning item listing: [list_title] is in pending state and awaiting administrative approval."
"_EMAIL_SITEREVIEW_POTTY LEARNING ITEM_APPROVAL_PENDING_BODY";"[header]

Your potty learning item listing is in pending state and awaiting administrative approval.

[list_title]
[list_description]

To visit this potty learning item listing, click on the link below, or copy-paste it in your browser:
[object_link]

[footer]"
"_EMAIL_SITEREVIEW_POTTY LEARNING ITEM_DECLINED_TITLE";"Potty Learning Item Listing Declined"
"_EMAIL_SITEREVIEW_POTTY LEARNING ITEM_DECLINED_DESCRIPTION";"This is the email that gets sent to a member when their potty learning item listing is declined."
"_EMAIL_SITEREVIEW_POTTY LEARNING ITEM_DECLINED_SUBJECT";"Your potty learning item listing: [list_title] has been declined."
"_EMAIL_SITEREVIEW_POTTY LEARNING ITEM_DECLINED_BODY";"[header]

Your potty learning item listing has been declined.

[list_title]
[list_description]

[footer]"
"_EMAIL_SITEREVIEW_POTTY LEARNING ITEM_CHANGEOWNER_EMAIL_TITLE";"Potty Learning Item - Listing Owner Changed"
"_EMAIL_SITEREVIEW_POTTY LEARNING ITEM_CHANGEOWNER_EMAIL_DESCRIPTION";"This is the email that goes to a member when owner of their potty learning item listing has been changed."
"_EMAIL_SITEREVIEW_POTTY LEARNING ITEM_CHANGEOWNER_EMAIL_SUBJECT";"Owner of the potty learning item listing: [list_title] has been changed."
"_EMAIL_SITEREVIEW_POTTY LEARNING ITEM_CHANGEOWNER_EMAIL_BODY";"[header]

The owner of the potty learning item listing: [list_title_with_link] has been changed. You are now no more the owner of this listing. All ownership rights for this listing have been transferred to the new owner.

For any queries or comments, you may contact us here: [site_contact_us_link].

To visit this potty learning item listing, click on the link below, or copy-paste it in your browser:
[object_link]

[footer]"
"_EMAIL_SITEREVIEW_POTTY LEARNING ITEM_CLAIMOWNER_EMAIL_TITLE";"Potty Learning Item Listing Claimed"
"_EMAIL_SITEREVIEW_POTTY LEARNING ITEM_CLAIMOWNER_EMAIL_DESCRIPTION";"This mail is sent to the Site Admin when any member claims that Listing."
"_EMAIL_SITEREVIEW_POTTY LEARNING ITEM_CLAIMOWNER_EMAIL_SUBJECT";"This potty learning item listing: [list_title] has been claimed."
"_EMAIL_SITEREVIEW_POTTY LEARNING ITEM_CLAIMOWNER_EMAIL_BODY";"[header]

This potty learning item listing: [list_title_with_link] has been claimed.

To view this potty learning item listing, click on the link below, or copy-paste it in your browser:
[object_link]

[footer]
"
"_EMAIL_SITEREVIEW_POTTY LEARNING ITEM_CLAIM_APPROVED_EMAIL_TITLE";"Potty Learning Item - Listing Owner Changed"
"_EMAIL_SITEREVIEW_POTTY LEARNING ITEM_CLAIM_APPROVED_EMAIL_DESCRIPTION";"This is the email that goes to a member when their claim for a listing has been approved."
"_EMAIL_SITEREVIEW_POTTY LEARNING ITEM_CLAIM_APPROVED_EMAIL_SUBJECT";"Your claim for potty learning item listing: [list_title] has been approved"
"_EMAIL_SITEREVIEW_POTTY LEARNING ITEM_CLAIM_APPROVED_EMAIL_BODY";"[header]

Congratulations! Your claim for the potty learning item Listing: [list_title_with_link] has been approved. You are now the owner of this listing.

To visit this potty learning item listing, click on the link below, or copy-paste it in your browser:
[object_link]

[footer]"
"_EMAIL_SITEREVIEW_POTTY LEARNING ITEM_BECOMEOWNER_EMAIL_TITLE";"Potty Learning Item - Listing Ownership Given"""
"_EMAIL_SITEREVIEW_POTTY LEARNING ITEM_BECOMEOWNER_EMAIL_DESCRIPTION";"This email goes to the new owner of the potty learning item listing when owner of a potty learning item listing is changed."
"_EMAIL_SITEREVIEW_POTTY LEARNING ITEM_BECOMEOWNER_EMAIL_SUBJECT";"You are now the owner of the potty learning item listing: [list_title]."
"_EMAIL_SITEREVIEW_POTTY LEARNING ITEM_BECOMEOWNER_EMAIL_BODY";"[header]

You are now the owner of the potty learning item Listing: [list_title_with_link]. All ownership rights for this listing have been provided to you.

For any queries or comments, you may contact us here: [site_contact_us_link].

To visit this potty learning item listing, click on the link below, or copy-paste it in your browser:
[object_link]

[footer]"
"_EMAIL_SITEREVIEW_POTTY LEARNING ITEM_CLAIM_HOLDING_EMAIL_TITLE";"Potty Learning Item Listing Claim Approval on Hold"
"_EMAIL_SITEREVIEW_POTTY LEARNING ITEM_CLAIM_HOLDING_EMAIL_DESCRIPTION";"This is the email that goes to a member when their claim for a potty learning item listing has been put on hold for approval."
"_EMAIL_SITEREVIEW_POTTY LEARNING ITEM_CLAIM_HOLDING_EMAIL_SUBJECT";"Your claim for potty learning item listing: [list_title] has been put on hold for approval"
"_EMAIL_SITEREVIEW_POTTY LEARNING ITEM_CLAIM_HOLDING_EMAIL_BODY";"[header]

Your claim for the potty learning item Listing: [list_title_with_link] has been put on hold for approval.

To visit this listing, click on the link below, or copy-paste it in your browser:
[object_link]

[comments]

[footer]
"
"_EMAIL_SITEREVIEW_POTTY LEARNING ITEM_CLAIM_DECLINED_EMAIL_TITLE";"Potty Learning Item Listing Claim Declined"""
"_EMAIL_SITEREVIEW_POTTY LEARNING ITEM_CLAIM_DECLINED_EMAIL_DESCRIPTION";"This is the email that goes to a member when their claim for a potty learning item listing has been declined."
"_EMAIL_SITEREVIEW_POTTY LEARNING ITEM_CLAIM_DECLINED_EMAIL_SUBJECT";"Your claim for potty learning item listing: [list_title] has been declined"
"_EMAIL_SITEREVIEW_POTTY LEARNING ITEM_CLAIM_DECLINED_EMAIL_BODY";"[header]

Your claim for this potty learning item Listing: [list_title_with_link] has been declined.

To visit this potty learning item listing, click on the link below, or copy-paste it in your browser:
[object_link]

[comments]

[footer]
"
"POTTY LEARNING ITEM Creation";"Listing Creation"
"Edit Potty Learning Item";"Edit Listing"
"Edit Potty Learning Item Contact Details";"Edit Listing Contact Details"
"Edit Potty Learning Item Meta Keywords";"Edit Listing Meta Keywords"
"Edit Potty Learning Item Where to Buy";"Edit Listing Where to Buy"
"Edit Potty Learning Item Profile Picture";"Edit Listing Profile Picture"
"Edit Potty Learning Item 'Where to Buy'";"Edit Listing 'Where to Buy'"
"Edit Potty Learning Item Details";"Edit Listing Details"
"Potty Learning Item Listings";"Potty Learning Item Listings"
"Post new potty learning item listings to this page.";"Post new potty learning item listings to this page."
"Post / Manage Potty Learning Item Listings";"Post / Manage Potty Learning Item Listings"
"Post New Potty Learning Item Listing";"Post New Potty Learning Item Listing"
"Add Potty Learning Item Listings";"Add Potty Learning Item Listings"
"Here, you can add various Potty Learning Item Listings to be associated with and displayed on your Page by using the auto-suggest below. From the auto-suggest, you can choose to add the Potty Learning Item Listings created by this Page’s Admins. Listings added by you here will display in a tab on your Page Profile.<br />Below, you can also remove listings added by you by using the link for each.";"Here, you can add various Potty Learning Item Listings to be associated with and displayed on your Page by using the auto-suggest below. From the auto-suggest, you can choose to add the Potty Learning Item Listings created by this Page’s Admins. Listings added by you here will display in a tab on your Page Profile.<br />Below, you can also remove listings added by you by using the link for each."
"Here, you can add various Potty Learning Item Listings to be associated with and displayed on your Page by using the auto-suggest below. From the auto-suggest, you can choose to add the Potty Learning Item Listings from various Potty Learning Item Listings created on this site. Listings added by you here will display in a tab on your Page Profile.<br />Below, you can also remove listings added by you by using the link for each.";"Here, you can add various Potty Learning Item Listings to be associated with and displayed on your Page by using the auto-suggest below. From the auto-suggest, you can choose to add the Potty Learning Item Listings from various Potty Learning Item Listings created on this site. Listings added by you here will display in a tab on your Page Profile.<br />Below, you can also remove listings added by you by using the link for each."
"Here, you can add various Potty Learning Item Listings to be associated with and displayed on your Page by using the auto-suggest below. From the auto-suggest, you can choose to add the Potty Learning Item Listings created by you. Listings added by you here will display in a tab on your Page Profile.<br />Below, you can also remove listings added by you by using the link for each.";"Here, you can add various Potty Learning Item Listings to be associated with and displayed on your Page by using the auto-suggest below. From the auto-suggest, you can choose to add the Potty Learning Item Listings created by you. Listings added by you here will display in a tab on your Page Profile.<br />Below, you can also remove listings added by you by using the link for each."
"Create Potty Learning";"Create Potty Learning"
"Manage Potty Learning";"Manage Potty Learning"
