Who all can add Videos to my business?|<p>You can choose who all can add Videos to your business while creating your business, by choosing the appropriate option for the &ldquo;Videos Creation Privacy&rdquo; field. You can edit this privacy any time by clicking on the &ldquo;Edit business Details&rdquo; link for your business.</p>|Business Solutions|Videos
How can I add a video to my business?|<p>You can add a Video to your business in one of the following ways:<br>1. To upload a Video, please follow the steps below:<br> a. Go to the business Profile.&nbsp;&nbsp; &nbsp;<br>b. Click &ldquo;Videos&rdquo; tab on the business Profile. You might have to click on the &ldquo;More&rdquo; tab to expand the menu bar to see &ldquo;Videos&rdquo;.<br>c. Click on &ldquo;Add a Video&rdquo; link from the top left corner of the &ldquo;Videos&rdquo; tab to add a video.<br>d. Fill up the form to add a video.<br>e. Select a video source and enter a Video Link (URL) of the video you want to add to the business.<br>f. Click on &ldquo;Save Video&rdquo;, to add a video to your business.<br>&nbsp;<br>2. From the &ldquo;Apps&rdquo; section of your business Dashboard, click on the &ldquo;Post a Video&rdquo; button and follow the steps from &lsquo;c&rsquo; to &lsquo;f&rsquo; as in case 1 above.</p>|Business Solutions|Videos
How many videos can I add to my business?|<p>There is no limit on the number of Videos that you can add to your business. You can add any number of Videos to your business.</p>|Business Solutions|Videos
From which all sources can I add Videos to my business?|<p>You can add Videos to your business by choosing the appropriate options for the&nbsp; &ldquo;Video Source&rdquo; field. Currently, the available sources from which you can add videos are: Youtube, Vimeo and your hard-drive. The availability of video sources is conditional depending on the settings chosen by our site administrator.</p>|Business Solutions|Videos
I want to search for a specific business Video. How can I do that?|<p>You can search for a business Video using the detailed search box available in the &ldquo;Videos&rdquo; section under business navigation.</p>|Business Solutions|Videos
What are Sponsored business Videos? How can Videos created on my business be made Sponsored?|<p>Sponsored business Videos are those Videos which have been created for Paid businesses. These Sponsored Videos will appear in the &ldquo;Sponsored Videos&rdquo; block in the &ldquo;Videos&rdquo; section under business navigation. On &ldquo;Browse Videos&rdquo; for business Videos and in search results, they are marked with a &ldquo;Sponsored&rdquo; marker. The search form for business Videos also has a quick filter for seeing Sponsored Videos.<br>If your business is created under a Paid Package, then the Videos created for it would automatically be made Sponsored. The availability of Paid business Packages on our site is conditional depending on the settings configured by our site administrators.</p>|Business Solutions|Videos
What are Featured business Videos? Who can mark Videos for businesses as Featured?|<p>Featured business Videos are videos of businesses which are specially marked as &ldquo;Featured&rdquo;. Such videos are more highlighted than others and thus gain more visibility. Featured business Videos appear in the &ldquo;Featured Videos&rdquo; slideshow in the &ldquo;Videos&rdquo; section under business navigation. On &ldquo;Browse Videos&rdquo; for business Videos and in search results, they are marked with a &ldquo;Featured&rdquo; marker. The search form for business Videos also has a quick filter for seeing Featured Videos.<br>business Videos can be made Featured only by our site administrators.</p>|Business Solutions|Videos
I have a business on this site. However, the Videos feature is not available for my business. What could be the reason?|<p>The reason why Videos feature is not available for your business could be that, you might have chosen a Package for your business for which the Videos App is not available. In this case, you can see if choosing a different Package with the Videos App suits you. You can change the Package for your business from the &ldquo;Packages&rdquo; section of your business Dashboard.<br>Availability of Packages for businesses, and their features are conditional depending on the settings chosen by our site administrator.</p>|Business Solutions|Videos