How can adding Music be useful for my group?|<p>Adding Music on your group will enable you create and share multiple Playlists on your group. An attractive music player provides great experience to visitors of your group. This is a great tool to showcase your talent and work on your group.</p>|Group Solutions|Music
How can I add Music to my group?|<p>You can add Music to your group in one of the following ways:<br>1. To add a music playlist, please follow the steps below:<br> a. Go to the group Profile.<br>b. Click &ldquo;Music&rdquo; tab on the group Profile. You might have to click on the &ldquo;More&rdquo; tab to expand the menu bar to see &ldquo;Music&rdquo;.<br>c. Click on &ldquo;Upload Music&rdquo; link from the top left corner of the &ldquo;Music&rdquo; tab to add music.<br>d. Fill up the form to add music. To make your group music playlist attractive, upload a suitable image for your &ldquo;Playlist Artwork&rdquo;.<br>e. Click on &ldquo;Add Music&rdquo; to upload music for your group.<br>f. Click on &ldquo;Save Music to Playlist&rdquo;, to save Playlist for your group.<br>&nbsp;<br>2. From the &ldquo;Apps&rdquo; section of your group Dashboard, click on the &ldquo;Upload Music&rdquo; button and follow the steps from &lsquo;d&rsquo; to &lsquo;f&rsquo; as in case 1 above.</p>|Group Solutions|Music
How many songs can I upload in a Playlist on my group?|<p>There is no limit to the number of songs that you can upload in a Playlist on your group. You can upload any number of songs on your group.</p>|Group Solutions|Music
How many Playlists can I create?|<p>There is no limit on the number of Playlists that you can create for your group. You can create any number of Playlists for your group.</p>|Group Solutions|Music
Can I rename my Playlists?|<p>Yes, you can rename your Playlists by using the &ldquo;Edit Playlist&rdquo; option for them.</p>|Group Solutions|Music
What is the purpose of “Play on group Profile”?|<p>Amongst the music playlists for your group, you might want to highlight one of them. This could be because that playlist might be a recent release, your most admired tracks, etc. The music playlist of your group for which you select the &ldquo;Play on group Profile&rdquo; option, will be prominently displayed on your group Profile in a block. This also makes your group more attractive.</p>|Group Solutions|Music
I want to search for a specific group Music playlist. How can I do that?|<p>You can search for a group Music playlist by using the detailed search box available in the &ldquo;Music&rdquo; section under group navigation.</p>|Group Solutions|Music
Who all can create Music on my group?|<p>You can choose who all can create Music for your group while creating your group, by choosing the appropriate option for the &ldquo;Music Creation Privacy&rdquo; field. You can edit this privacy any time by clicking on the &ldquo;Edit group Details&rdquo; link for your group.</p>|Group Solutions|Music
I have a group on this site. However, the Music feature is not available for my group. What could be the reason?|<p>The reason why Music feature is not available for your group could be that, you might have chosen a Package for your group for which the Music App is not available. In this case, you can see if choosing a different Package with the Music App suits you. You can change the Package for your group from the &ldquo;Packages&rdquo; section of your group Dashboard.<br>Availability of Packages for groups, and their features are conditional depending on the settings chosen by our site administrator.</p>|Group Solutions|Music